{
  "version": 1,
  "product": "W_Flyer",
  "environment": {
    "browser": "Playwright 1.57 with system Chromium headless",
    "device_scale_factor": 1,
    "note": "Baselines documentais de composição com identidade temporária somente textual; não screenshots do aplicativo de produção."
  },
  "baselines": [
    {
      "path": "golden-pages/ensemble-package/desktop.png",
      "sha256": "5553a6a9c3cdcf99ca009ed0c512500fc4d689cbab1b50fbbc4914e02642c8de",
      "width": 1440,
      "height": 900,
      "status": "candidate_human_review_required",
      "generated_from": "internal_html_prototype",
      "generated_at": "2026-07-27",
      "branding": "pending_text_only"
    },
    {
      "path": "golden-pages/ensemble-package/mobile.png",
      "sha256": "931d0f6261773e4d9fc70eee631ba5062d7dcbf8add3266b310b50d5ab2b59ac",
      "width": 466,
      "height": 1489,
      "status": "candidate_human_review_required",
      "generated_from": "internal_html_prototype",
      "generated_at": "2026-07-27",
      "branding": "pending_text_only"
    },
    {
      "path": "golden-pages/harmonization-lab/desktop.png",
      "sha256": "b93c82849a9db96c159b7ecdf0e105207b43b61fc499680ba1da1504b2925eef",
      "width": 1536,
      "height": 960,
      "status": "candidate_human_review_required",
      "generated_from": "internal_html_prototype",
      "generated_at": "2026-07-27",
      "branding": "pending_text_only"
    },
    {
      "path": "golden-pages/harmonization-lab/mobile.png",
      "sha256": "8aeb9cdb0033630db9ae17ac7385556aa65ca26350fe4b2b3341a140f43cb4e3",
      "width": 504,
      "height": 1867,
      "status": "candidate_human_review_required",
      "generated_from": "internal_html_prototype",
      "generated_at": "2026-07-27",
      "branding": "pending_text_only"
    },
    {
      "path": "golden-pages/home/desktop.png",
      "sha256": "bd950609a8b8eac96a0be42df805909703a9e81fbc4b48c90f4f6c5e1ec550df",
      "width": 1440,
      "height": 900,
      "status": "candidate_human_review_required",
      "generated_from": "internal_html_prototype",
      "generated_at": "2026-07-27",
      "branding": "pending_text_only"
    },
    {
      "path": "golden-pages/home/mobile.png",
      "sha256": "f10a889d1faabafc22ad3b2e9f23746664200eab21da3664cc409534f3890286",
      "width": 390,
      "height": 1113,
      "status": "candidate_human_review_required",
      "generated_from": "internal_html_prototype",
      "generated_at": "2026-07-27",
      "branding": "pending_text_only"
    },
    {
      "path": "golden-pages/melody-review/desktop.png",
      "sha256": "4c043ceea645c2e99e9c8e1782c90d347b7c9ccd0126855bcf5817bf1afa881d",
      "width": 1440,
      "height": 900,
      "status": "candidate_human_review_required",
      "generated_from": "internal_html_prototype",
      "generated_at": "2026-07-27",
      "branding": "pending_text_only"
    },
    {
      "path": "golden-pages/melody-review/mobile.png",
      "sha256": "8eca71c4b393b551c8eec0e528da7619dc922952d1a1fd3b06050ae52b7e0b5f",
      "width": 469,
      "height": 1551,
      "status": "candidate_human_review_required",
      "generated_from": "internal_html_prototype",
      "generated_at": "2026-07-27",
      "branding": "pending_text_only"
    },
    {
      "path": "golden-pages/processing/desktop.png",
      "sha256": "d057a9b059342fe414fd2f41853520d69d5623b1f1ad5039abb11f0d3860da0b",
      "width": 1440,
      "height": 900,
      "status": "candidate_human_review_required",
      "generated_from": "internal_html_prototype",
      "generated_at": "2026-07-27",
      "branding": "pending_text_only"
    },
    {
      "path": "golden-pages/processing/mobile.png",
      "sha256": "f3182e3bd484cb007aaaea8e48ee4af3800d4ed18a04b094303e7deb1b52a92f",
      "width": 390,
      "height": 1596,
      "status": "candidate_human_review_required",
      "generated_from": "internal_html_prototype",
      "generated_at": "2026-07-27",
      "branding": "pending_text_only"
    },
    {
      "path": "golden-pages/rehearsal-mode/desktop.png",
      "sha256": "eb2197b9098f162c2a844f35972fe88476333ebace3ff761847d62af57df3725",
      "width": 1440,
      "height": 900,
      "status": "candidate_human_review_required",
      "generated_from": "internal_html_prototype",
      "generated_at": "2026-07-27",
      "branding": "pending_text_only"
    },
    {
      "path": "golden-pages/rehearsal-mode/mobile.png",
      "sha256": "0585f02c242bfd9ca6731e8f3dca6f151496b129f56ff231d196f058272c64b6",
      "width": 601,
      "height": 1301,
      "status": "candidate_human_review_required",
      "generated_from": "internal_html_prototype",
      "generated_at": "2026-07-27",
      "branding": "pending_text_only"
    },
    {
      "path": "golden-pages/result-comparison/desktop.png",
      "sha256": "023a86bfbd8a2f772596ee466ae8ff95e927a296eddc76f4970d83af944e8334",
      "width": 1536,
      "height": 960,
      "status": "candidate_human_review_required",
      "generated_from": "internal_html_prototype",
      "generated_at": "2026-07-27",
      "branding": "pending_text_only"
    },
    {
      "path": "golden-pages/result-comparison/mobile.png",
      "sha256": "24ca27224ccfe9dc801bbde0ea50fe9284b9a2cbf9e2a37734b270e83c493ab2",
      "width": 459,
      "height": 1657,
      "status": "candidate_human_review_required",
      "generated_from": "internal_html_prototype",
      "generated_at": "2026-07-27",
      "branding": "pending_text_only"
    },
    {
      "path": "golden-pages/transpose-workspace/desktop.png",
      "sha256": "f312a31ac7a0204e61e5438e0a05b148577b95aac4a3307e997aa9d2cafc9e67",
      "width": 1440,
      "height": 900,
      "status": "candidate_human_review_required",
      "generated_from": "internal_html_prototype",
      "generated_at": "2026-07-27",
      "branding": "pending_text_only"
    },
    {
      "path": "golden-pages/transpose-workspace/mobile.png",
      "sha256": "2615b7d2815b03a39c11fa5d9ca70870a0e0df0f2371f64e8d088dc0f22f6d21",
      "width": 459,
      "height": 1541,
      "status": "candidate_human_review_required",
      "generated_from": "internal_html_prototype",
      "generated_at": "2026-07-27",
      "branding": "pending_text_only"
    },
    {
      "path": "golden-pages/upload-error/desktop.png",
      "sha256": "9c909ed9632c726f8f6b2504890bfb0d26aedfd4df21e77ddd5566bde63f8e42",
      "width": 1440,
      "height": 900,
      "status": "candidate_human_review_required",
      "generated_from": "internal_html_prototype",
      "generated_at": "2026-07-27",
      "branding": "pending_text_only"
    },
    {
      "path": "golden-pages/upload-error/mobile.png",
      "sha256": "670468be8c1ff9f5823e3e630202c12628986fbdb8602c0e64381305374c2066",
      "width": 390,
      "height": 1398,
      "status": "candidate_human_review_required",
      "generated_from": "internal_html_prototype",
      "generated_at": "2026-07-27",
      "branding": "pending_text_only"
    }
  ]
}
